ID,Category,Question,Includes
1,Pedagogy (General),What are the long-term impacts of adopting better teaching practices in computing classes?,
2,Pedagogy (General),What teaching practices are currently being used in computing classes?,
3,Awareness and Broader Impact,Do major news stories about technology and technology companies affect enrolments?,
4,Languages and Tools,What are the relative merits of using a typed vs untyped language in an introductory programming class?,140; 293
5,Awareness and Broader Impact,What are the long-term benefits (if any) of people learning to program as children?,111
6,Student Behavior,What kinds of problems do students in programming classes find most engaging?,68
7,Pedagogy (General),What is the most effective way to provide feedback to students in programming classes?,158; 267
9,Languages and Tools,What are the relative merits of using blocks-based tools vs textual tools for introductory programming classes?,16; 94; 102; 266; 281; 395
10,Languages and Tools,"What are the relative merits of using frameworks, pre-built code snippets, or skeletons in introductory programming classes?",133; 284
12,Curriculum,Are current high school curricula meeting the needs of college or university programs and/or employers?,
13,Pedagogy (Computing),What are the merits (if any) of using gamification in programming classes?,
14,Student Behavior,What is the impact of student procrastination on performance and outcomes in introductory programming classes?,
15,Curriculum,Is the common division of introductory courses into CS0/CS1/CS2 effective?,
17,Student Behavior,How and why do students in computing classes select the study practices they use?,
18,Inclusivity,How does programming language syntax affect accessibility for students with reading disorders?,344
19,Inclusivity,"How do attrition rates for different groups compare during computing programs, the transition to industry, and in professional careers?",
20,Languages and Tools,What technical difficulties do teachers and schools face when trying to get IDEs and other tools installed for students?,
23,Pedagogy (General),What are the relative merits of videos with live coding or interactive live coding textbooks in programming classes?,
24,Curriculum,Does teaching students specific algorithms help their understanding of algorithms and problem solving in general?,
25,Pipeline,Do incoming students have the mathematical understanding and skills required by undergraduate Computer Science programs?,
26,Curriculum,What competencies should people have with computers before starting to learn programming?,
27,Student Understanding,What should students in programming courses learn about computer architecture?,109
28,Curriculum,What core technical skills should students in computing courses learn?,
29,Inclusivity,What barriers to learning and retention do students from underrepresented groups face in computing?,
30,Assessment and Predictors,How can we measure the transfer of skills and understanding for our students from one course to another?,
31,Pedagogy (General),"What are the relative merits of instructor-led learning, exploratory learning (“Googling for it”) and peer discussion in programming courses?",31
32,Pedagogy (Computing),What are the relative merits of presenting tools all at once vs presenting subsets of tools in stages?,
33,Student Understanding,What are the key concepts that students need to understand in introductory computing classes?,
34,Curriculum,To what extent do results from Computing Education research studies generalize outside of the regions in which the studies are conducted?,
35,Languages and Tools,How well does the use of game-making programs in primary/secondary courses prepare students for college or university computing courses?,
36,Pipeline,What factors best predict how successfully students will make the transition from school to industry?,
40,Awareness and Broader Impact,"How well do students, parents, teachers, and schools understand the difference between programming and other digital technologies?",
41,Pedagogy (General),What teacher actions are most likely to encourage creative thinking in computing classes?,
42,Pedagogy (Computing),What are the most effective ways to teach programming to various groups?,59
43,Inclusivity,What influences girls’ decisions to take primary/secondary computing classes?,194; 264
44,Student Understanding,How do students acquire and develop program comprehension skills?,
45,Inclusivity,What are the most effective ways to develop computing competency among students in non-computing disciplines?,11; 64; 114; 249; 254; 345; 347; 353
46,Pipeline,"What are the relative effects on retention of first exposure to computing through maker spaces, coding clubs, etc. vs structured classroom contexts?",
47,Pedagogy (Computing),What are the relative merits of teaching higher-level courses on data structures and algorithms with and without practical labs?,
49,Student Understanding,What are students’ most common misconceptions about how programs operate?,
50,Teacher Development,"(How) can we make it easier for teachers to create, revise, share, evaluate, find and get credit for teaching materials?",
51,Inclusivity,(How) can we encourage people without formal Computer Science training or backgrounds to contribute to open source projects?,
52,Pipeline,What development practices used by professional programmers are most important to teach to students?,
53,Awareness and Broader Impact,(How) can learning programming concepts assist learning in other areas?,62; 120
54,Curriculum,What are the relative merits of teaching functional programming first vs teaching imperative programming first?,
55,Inclusivity,What are the proportions of computing students who identify as male vs those who identify as female?,
56,Curriculum,How do the content and teaching methods of informal computing education compare to those of formal computing education?,
57,Pipeline,How well does someone’s ability to pattern match correlate with their performance in their first programming course?,
58,Teacher Development,What pedagogic theories are used (explicitly or tacitly) by computing instructors?,
60,Pipeline,What factors best predict how successfully students will make the transition from school to industry?,
61,Curriculum,What effect does the use of unit testing in a first programming course have on students’ ability to build correct programs?,
63,Pipeline,What effect does participation in out-of-school coding camps and similar activities have on students’ attitudes toward in-school computing classes they subsequently encounter?,
66,Inclusivity,What are the most effective ways to teach introductory computing to students without prior programming knowledge?,
67,Pedagogy (General),(How) do formal curricular goals support the development of programming skills and computational thinking in students?,
69,Student Understanding,What do we need to teach students so that they can transfer skills and understanding from one language to another?,294
70,Languages and Tools,What are the impacts of teaching specific languages on students’ understanding of Computer Science concepts?,
71,Languages and Tools,"How does the use of Unicode variable names (i.e., mathematical symbols) affect error rates in students’ programs?",
72,Inclusivity,How likely are students from underrepresented groups to ask a question in class compared to students from majority groups?,
73,Teacher Development,How can teachers be trained or recruited in order to be inspirational and effective?,
74,Curriculum,How useful is it for students to learn about older computing technologies?,
76,Pipeline,What is the impact of students’ literacy skills on their success in programming (both in school and beyond)?,
77,Student Understanding,What fundamental programming concepts are the most challenging for students?,193; 237
78,Pipeline,What impact does early exposure to security topics and tools have on student retention and/or comprehension in Computer Science programs?,
80,Pedagogy (General),(How) does the best teaching method or language depend on the learner’s personality or other characteristics?,
81,Pedagogy (Computing),How can we teach students how to deconstruct programming problems?,
82,Curriculum,To what extent should lessons and practices from industry influence the way we teach programming?,
83,Curriculum,What computing skills or knowledge are the best predictors of student success?,
84,Student Understanding,(How) can we help technically-oriented students value human-centered aspects of computing?,
88,Assessment and Predictors,What impact does learning to program have on students’ competence in mathematics?,367
89,Languages and Tools,What languages are most effective for teaching children?,
90,Curriculum,What resources can computing teachers use that are not language specific?,
91,Student Behavior,"What benefits do social aspects of classes (e.g., collaboration) have on novice programmers?",
92,Inclusivity,"How effective are combination programs (e.g., math + CS) at attracting students from underrepresented groups?",
93,Pedagogy (Computing),"What is the impact of teaching computing concepts “unplugged” (i.e., without programming) alongside teaching programming?",
95,Student Understanding,What do people find most difficult when breaking problems down into smaller tasks while programming?,
98,Pedagogy (General),"How does the effectiveness of short, condensed courses compare to that of longer, less intensive courses?",362
99,Inclusivity,What role does family background play in students’ decisions to take (or not take) computing classes?,
100,Pedagogy (General),What are the relative merits of teaching top down (high-level concepts first) vs bottom up (concrete operations first)?,375
101,Assessment and Predictors,Is it possible to predict how well someone will do in their first programming course if they have never programmed before?,121; 278
103,Pedagogy (General),What are the relative merits of teaching computing concepts breadth first vs depth first?,
104,Student Behavior,Does planning a program using pseudocode or flowcharts before starting to code improve students’ outcomes?,215; 219
105,Assessment and Predictors,What types of pre-classroom preparation are most effective at getting students ready to learn Computer Science?,
106,Pipeline,What impact does taking a computing course in primary/secondary school have on students’ decisions to take or not take computing at college or university?,
107,Inclusivity,What are the best teaching strategies to use in computing classes for students with physical disabilities?,
108,Languages and Tools,Are game-based tools like Unity and GameMaker effective for developing programming skills after block-based tools like Scratch but before text-based tools like Python?,
112,Pedagogy (Computing),What are best practices for instruction in a computer lab?,
113,Curriculum,What is the minimum amount of time that needs to be devoted to introducing non-Computer Science students to programming in order for it to be useful?,
115,Curriculum,What are the relative merits of teaching object-oriented programming first vs teaching imperative programming first?,
116,Student Behavior,What events or activities first make students self-identify as programmers?,
117,Languages and Tools,What are the relative merits of sticking to one programming language when teaching children vs using two or more languages?,
118,Pipeline,What are the most useful things high school teachers can do to help students succeed in computing careers (both in academia and industry)?,
122,Pedagogy (Computing),What kinds of programming exercises are most effective when teaching students Computer Science?,
123,Pedagogy (General),What practices are most effective when teaching programming in very large classes (hundreds of students)?,
124,Assessment and Predictors,How can an instructor tell whether students are actually reflecting on their work?,
125,Pedagogy (General),"To what extent, and how, should self-directed learning be used to complement in-person teaching in computing?",
126,Pedagogy (General),What teaching methods or curriculum are most effective at persuading students in other disciplines to incorporate programming into their work?,
127,Pipeline,What knowledge and skills are new graduates of computing programs most often missing that they need?,
128,Languages and Tools,What languages or tools are most effective for introducing object-oriented programming?,
129,Pedagogy (Computing),What computing concepts and skills can young children (up to 7/8) actually learn?,
130,Assessment and Predictors,What are the most effective ways to monitor and track students’ work in computing classes?,
131,Student Behavior,Why do so few students take computing classes in high school?,
132,Pedagogy (Computing),What are effective methods for teaching students to develop algorithms prior to beginning coding?,
134,Teacher Development,What types of training for TAs are most effective?,361
135,Languages and Tools,"How easily can students transition from the 2D model of turtle graphics used in Scratch, Logo, and similar systems to thinking in 3D?",
136,Assessment and Predictors,How well does someone’s “grit” predict how well they will do in their first programming course if they have never programmed before?,
137,Inclusivity,What can teachers do to improve participation by underrepresented groups in computing?,214; 265; 350
138,Student Behavior,What steps are most likely to reduce drop rates in online computing courses?,
139,Languages and Tools,What impact does learning block-based tools like Scratch have on subsequently learning text-based tools like Python?,181; 208; 348
141,Languages and Tools,How easily can students switch between different programming languages while learning?,
142,Pedagogy (Computing),What teaching practices are most effective for teaching computing to children?,285
143,Student Behavior,"What factors most influence drop rates in introductory computing classes and (how) do these factors vary according to student demographics (age, gender, orientation, etc.)",
144,Student Understanding,Why do some students believe that software development is solely a matter of programming?,
146,Inclusivity,"What is the relationship between student demographics (age, gender, orientation, etc.) and their understanding of fundamental computing concepts?",
147,Pipeline,What do students learn in college or university computing programs that they consider most valuable two years after graduation?,
148,Curriculum,How important is it for students to have a general understanding of how computers work before learning programming concepts?,388
150,Pedagogy (Computing),How can we improve computational thinking skills in high school students?,
151,Curriculum,What is the effect of work load and pacing on motivation and retention in introductory computing courses?,
152,Student Behavior,"When and why do students ask for help in labs, and are such questions a sign that things are going well or not?",
153,Teacher Development,How is “good quality software” defined for computing teachers and how does this compare to the way that professionals define it?,
154,Pedagogy (General),"(How) do student demographics (age, gender, orientation, etc.) determine the effectiveness of different teaching methods?",
155,Pedagogy (Computing),To what extent is learning to program like learning to speak a language?,
156,Pipeline,How well can students who have gone through Computer Science programs adapt to changing market needs?,
157,Curriculum,Should databases be taught at the high school level?,
159,Pedagogy (Computing),What content and teaching methods are most effective at helping students learn how to design software?,247
160,Languages and Tools,(How) do online/automated grading systems for programming affect learning outcomes?,48; 160; 220; 252; 373
162,Pedagogy (Computing),How effective are pair programming and peer review in introductory computing courses?,
163,Curriculum,Should students learn Unix commands and basic shell scripting before or after learning a more general purpose programming language?,
164,Pipeline,Why do students enrol in computing programs?,
165,Pedagogy (Computing),What is the most effective way to introduce the notion of a variable in computing classes?,
166,Pipeline,What language is it most useful for a college- or university-bound student to learn?,
168,Student Understanding,"(How) can we convince students that documentation is important, particularly when they may not continue in computing?",
171,Student Behavior,(How) can teachers convince students who believe they “just don’t get” computing that they can do it?,
172,Assessment and Predictors,"How well does participation in non-programming activities (course attendance, reading, discussion) predict outcomes in programming courses?",
173,Assessment and Predictors,How do differences in the way instructors understand software development projects affect the way students learn good software development practices?,
174,Pedagogy (Computing),What are the relative merits of teaching the mechanics of specific systems vs teaching high-level principles in higher-level topics such as databases and networks?,
175,Assessment and Predictors,How well do standardized secondary school examinations predict how students will do in their first college- or university-level programming course?,
176,Teacher Development,How effective is it to retrain high school teachers from other disciplines to teach computing?,
177,Student Behavior,What online resources do learners most frequently consult when learning to program?,
178,Student Understanding,What are the differences between the way experts program and the way students program?,
179,Teacher Development,"What are effective methods for “training the trainers”, i.e., for teaching people how to teach others to teach computing?",
180,Assessment and Predictors,What relationship is there between student performance in computing and student performance in other subjects?,
182,Assessment and Predictors,What effect does teaching students computing and computational thinking in primary school have on their performance in high school?,
183,Languages and Tools,What impact does choice of teaching language have on how much students learn about fundamental computing concepts?,
184,Awareness and Broader Impact,Is it important for students to learn programming and digital technologies?,
185,Languages and Tools,What is the best language to use when teaching introductory programming courses?,236; 305; 346
186,Student Behavior,How does a sense of self-efficacy influence students’ success outside of their courses?,
187,Student Understanding,What impact does teaching introductory courses using only data analysis/machine learning examples have on student understanding?,
188,Awareness and Broader Impact,What programming experiences do people most often have before attending their first programming workshop?,
190,Pipeline,What impact (if any) does the language learned in secondary school have on students’ conceptual understanding of computing at college or university?,
191,Curriculum,What are the relative merits of teaching children logic vs teaching them programming?,
192,Student Behavior,Why do students take Computer Science classes at college or university?,
195,Pipeline,How many students are retained in each level of a typical college or university computing program?,
196,Student Behavior,"What features of classes, students, or pedagogy most affect attendance, engagement, and performance?",
198,Curriculum,"What is the best order in which to introduce control flow (e.g., loops) and functions?",
199,Pedagogy (General),What are the merits (if any) of using large projects in class when teaching computing?,
200,Curriculum,What are the most important things that students finishing college or university computing programs still don’t understand?,376
201,Pipeline,What topics in computing are going to be more important for students to learn in the near future?,
204,Curriculum,What is the best order in which to teach basic computing concepts and skills?,309
206,Student Understanding,What incorrect mental models do students bring to their first computing courses?,
207,Pedagogy (General),Does growth mindset instruction alter outcomes in computing courses?,
209,Teacher Development,(How) can teachers avoid burnout in the face of rising enrolments without compromising quality of instruction?,
210,Student Understanding,Does learning programming involve mental barriers that do not exist in other subjects?,
211,Curriculum,How do colleges/universities justify their choice of their introductory programming language?,
213,Teacher Development,Why do some teachers believe that some students “get it” and some don’t when it comes to programming?,
216,Pedagogy (General),What teaching strategies are most effective when dealing with a wide range of prior experience in introductory programming classes?,330
217,Assessment and Predictors,"What is the relationship between student demographics (age, gender, orientation, etc.) and prior experience and their success in introductory college or university computing classes?",
221,Languages and Tools,What is the best hardware (such as programmable boards and robots) to use for introductory computing classes?,
222,Pipeline,What is the best age (if any) at which to start teaching children a text-based programming language?,194
223,Pipeline,What should I tell students who have impostor syndrome or self-doubt after hearing companies say that they only want the best of the best?,
224,Assessment and Predictors,Do exams taken on a computer measure learning more accurately than written exams?,250; 255
225,Student Behavior,Do students’ attitudes toward making mistakes predict how much they will enjoy computing courses and/or how well they will do in them?,
226,Student Understanding,Is there such a thing as “computational thinking”?,
227,Student Behavior,"How can we motivate students in computing classes to attend class, do assigned readings, and participate in exercises?",21; 85; 232
228,Assessment and Predictors,To what extent is being technically proficient in using a computer helpful to learning Computer Science?,
229,Inclusivity,How do students with hearing disabilities learn computing?,
230,Pedagogy (General),What methods for teaching problem solving skills are most effective for different age groups?,
233,Assessment and Predictors,Is it possible to predict how well someone will do as a computing professional before they enrol in a college or university computing program?,
235,Pedagogy (General),How do students respond to open-ended exercises in programming courses?,
238,Awareness and Broader Impact,"Will programming ever be regarded as being as important to learn as reading, writing, or arithmetic?",
239,Pipeline,What knowledge and skills are new entrants into computing programs most often missing that they need?,289; 369
240,Awareness and Broader Impact,Can we/should we integrate computing or computational thinking into the entire high school curriculum?,
242,Pedagogy (Computing),What are the most effective ways to teach people how to program?,
243,Inclusivity,Do early outreach activities influence girls’ decision to enter computing?,
245,Languages and Tools,What effect (if any) does choice of first language have on the degree to which students can transfer understanding to programming in other languages?,
246,Languages and Tools,What is the most effective way to move students from block-based programming to text-based programming?,
248,Teacher Development,What are the most important things for teachers to know about computing education research in order to collaborate effectively with researchers?,
251,Languages and Tools,How do teachers and schools select the programming languages they teach?,
253,Curriculum,What are the benefits (if any) of teaching computing concepts across various subjects rather than concentrating them in a dedicated computing course?,333
256,Assessment and Predictors,Are students who are required to write detailed documentation for code better able to reason about it?,
257,Pedagogy (Computing),Is learning computing fundamentally different in any way from learning other subjects?,
258,Inclusivity,Is proportional representation of women and other groups currently underrepresented in computing achievable?,
260,Pipeline,To what extent if any are (potential) students confused by the number of options available to them for learning computing?,
261,Pedagogy (Computing),Is explicit discussion of abstract concepts such as patterns or debugging helpful when teaching novices to program?,
262,Pedagogy (Computing),How effective are online courses in teaching general programming skills to high school students?,
263,Inclusivity,What are the best ways to teach fundamental programming concepts and skills to learners coming from low tech/low computer literacy backgrounds?,
268,Pedagogy (Computing),Are recursive functions best taught and understood using proof rules (such as induction) or hand simulation?,
269,Curriculum,How does being taught for-each loops first affect a student's ability to later learn to write indexed loops?,
270,Assessment and Predictors,(How) can we predict which of the skills we teach students they will then go on to use?,vague
271,Curriculum,"Should topics such as databases, networking, and operating systems be taught in specialized courses, or should that content be merged into more wide-ranging courses?",
272,Inclusivity,What can schools and teachers do to increase the chances of success for students in their first college or university computing course?,
273,Pedagogy (General),How much do students learn from lectures vs how much do they learn from practical work such as programming assignments?,
