ID,Category,Question,Includes
274,Pedagogy (Computing),(How) does the best way to teach programming depend on the language being used?,
275,Awareness and Broader Impact,Is there a best age at which to start learning how to program?,
276,Pedagogy (General),What is the best balance between lectures and lab work?,
277,Curriculum,What content from general introductory computing courses is most relevant to students taking more advanced courses in topics such as networking and computer architecture?,
279,Awareness and Broader Impact,How important do students who are not already in computing programs believe it is to learn a programming language?,
280,Languages and Tools,Is it possible to design programming languages that are significantly easier to learn than the ones in use today?,
282,Pipeline,What do colleges/universities look for in students applying to enter computing programs?,
283,Pedagogy (Computing),To what extent does frequent help from instructors and TAs help students who are struggling to master material in computing courses?,
286,Curriculum,How important is it to teach compiled programming languages?,
288,Pipeline,How can we best involve students in computing education research?,
291,Languages and Tools,What are the best ways to make documentation about libraries and APIs accessible to students?,
292,Languages and Tools,What are the relative merits of using computational notebooks (like Jupyter) vs teaching the same languages and content using traditional text formats?,332
295,Pipeline,How can we help students connect what they have learned in class with what they encounter in the workplace?,
296,Awareness and Broader Impact,Are different regions taking different approaches to computing education?,
297,Awareness and Broader Impact,What factors have led to the increase in the number of students taking computing courses in the past few years?,
299,Teacher Development,How can we better connect subject matter experts who lack teaching expertise with experts in teaching who lack in-depth computing knowledge?,
300,Pedagogy (Computing),What are the most effective ways to scale computing education to reach the general student population?,
301,Pedagogy (Computing),What is the most effective way to teach algorithms in computing courses?,
302,Assessment and Predictors,What are the benefits (if any) of having a mathematics prerequisite to an introductory computing course?,
303,Pedagogy (Computing),What are the best ways to teach programming to people with no previous programming experience?,
304,Curriculum,"When should students learn how to install software, manage paths and environments, etc.?",
306,Pedagogy (Computing),What is the most effective way to teach students how to test software?,
307,Curriculum,"How do teaching approaches differ between Computer Science, Information Technology, and related disciplines?",
310,Languages and Tools,What is the best balance between using modern software development tools and overloading students?,
311,Assessment and Predictors,What factors in primary/secondary education best predict success for students in college or university computing and beyond?,38; 231; 337; 368
312,Languages and Tools,How effective are game development tools like Unity for teaching computing vs conventional languages like Python?,145; 363
313,Teacher Development,"What factors inspire high school Computer Science teachers, increase their confidence, and lower attrition rates?",
314,Curriculum,What concepts are taught in college or university computing programs?,
316,Inclusivity,Has the uptake of for-profit STEM-oriented daycare and camps by middle-class families affected access to computing programs for students from less affluent backgrounds?,
317,Teacher Development,What is the single most effective change Computer Science departments could make to their teaching practices?,
318,Pedagogy (Computing),Do data diagrams help students understand language features and code execution?,
319,Student Understanding,How often do students have “ah ha” moments in computing courses in which things suddenly start to make sense?,
321,Pedagogy (General),How can we help students become comfortable with failure in computing courses?,
322,Awareness and Broader Impact,What factors have led to differences in the implementation of computing in secondary education in different regions?,
324,Pedagogy (Computing),What is the best way to use extended programming tasks in large computing courses?,
325,Awareness and Broader Impact,What do high school students think Computer Science is?,
326,Pedagogy (Computing),What are the most effective ways to teach data structures?,
327,Languages and Tools,Do tools like Alice help students understand object-oriented programming concepts in CS2?,
328,Pedagogy (General),"Can some teaching practices make a difference to students’ ability to write programs, or is learning to program primarily a matter of practice?",
329,Student Understanding,To what degree are students able to attain higher levels of understanding (as per Bloom’s Taxonomy) in computing programs?,
331,Pedagogy (Computing),What teaching methods best help students remember the syntax of programming languages?,
336,Inclusivity,"Is programming ability an intrinsic attribute, or can anyone become proficient at programming?",389
338,Languages and Tools,What are the best tools to use when teaching people how to program on smart phones?,
339,Teacher Development,How can we recruit more external (industry) partners to collaborate on classroom programming projects?,
340,Teacher Development,How can teachers stay up to date with changes to technology and programming practices?,22; 366
341,Student Understanding,What topics in computing are most difficult for high school students to grasp?,
342,Pipeline,Is it more beneficial for new graduates of computing programs to have strong individual skills or strong team skills?,
349,Pedagogy (Computing),When and how is it best to present advanced computing techniques to students who are new to programming?,
351,Pedagogy (Computing),How and when is it best to give students feedback on their code to improve learning?,
352,Pipeline,To what extent do people continue to program after moving into management positions?,
354,Student Understanding,Which student misconceptions about computing are most difficult to correct?,
355,Pedagogy (Computing),What are best practices for using computers in computing classes?,
356,Pipeline,What topics or skills can be taught to primary/secondary students to best prepare them to learn or appreciate computing at college or university?,393
357,Pedagogy (General),"What are the relative merits of project-based learning, lecturing, and active learning for students learning computing?",189; 334
358,Pedagogy (Computing),What are the relative benefits of live coding vs presentations or guided exercises?,
359,Student Behavior,What are the most effective ways to keep diverse groups of students engaged when teaching computing?,8; 39; 308
360,Student Understanding,What misconceptions do students have about operating systems?,
364,Curriculum,What is the best balance between theory and hands-on practice in a computing program?,96; 202; 205; 287; 298
365,Awareness and Broader Impact,Do students have an accurate understanding of the time and effort required to learn programming?,
370,Curriculum,What is the most effective way to teach digital technologies in high schools without diluting content?,
371,Inclusivity,Do female students learn computing more effectively in all-female classes?,
372,Pedagogy (Computing),What is the most effective way to teach control structures such as loops to students who are not computing majors?,
374,Languages and Tools,What are the relative benefits of provisioning a computing environment for students vs requiring them to manage installation issues themselves?,
377,Teacher Development,What technical difficulties do teachers trying to use new tools or applications encounter?,
378,Pedagogy (Computing),Can student learning be enhanced by explicit lessons on how to use Stack Overflow and similar online forums?,
379,Student Understanding,At what developmental stage can people first effectively use “variable” as an abstraction?,
380,Pedagogy (Computing),What are the characteristics of good homework assignments in computing classes?,
381,Curriculum,What are the most effective ways for teachers to keep course materials up to date?,
382,Student Behavior,To what extent are “free riders” actually a problem in group computing projects?,
383,Pipeline,To what degree do different fields of graduate student require or rely on computing skills?,
384,Pedagogy (Computing),Does explicit reference to a programming language the student already knows help or hinder learning a second language?,
385,Curriculum,What is the best way to integrate data management practices into a computing curriculum?,
386,Pipeline,What can be done in high schools to close the gap between the supply of programmers and the demand for them?,
387,Languages and Tools,"If students have multiple courses using the same language, do they benefit more from using the same tools or from using a variety of tools?",
390,Languages and Tools,What are the relative benefits of giving students standard hardware vs having them bring their own devices?,
391,Assessment and Predictors,To what extent (if any) does the choice of first programming language affect students’ interest in pursuing more programming courses?,
392,Pipeline,How do the long-term career prospects for participants in coding bootcamps compare to those of students taking part in traditional classroom computing programs?,
394,Student Behavior,What can be done in class to motivate students to use good software engineering practices on larger projects?,
396,Student Understanding,"Is ""expression"" a threshold concept?",
397,Student Understanding,What affects students’ ability to generalize from simple programming examples?,
398,Inclusivity,"To what extent (if any) does the impact of using block-based programming in introductory courses vary according to student demographics (age, gender, orientation, etc.)?",
399,Pedagogy (Computing),How do learning outcomes differ when students use their own code and/or data in programming classes vs using code and/or data provided by the instructor?,
400,Awareness and Broader Impact,What can teachers do to ensure adequate funding for computing classes?,