id,category_id,content
318,6,"Do data diagrams help students understand language features and code execution?"
319,9,"How often do students have 'ah ha' moments in computing courses in which things suddenly start to make sense?"
321,1,"How can we help students become comfortable with failure in computing courses?"
322,2,"What factors have led to differences in the implementation of computing in secondary education in different regions?"
324,6,"What is the best way to use extended programming tasks in large computing courses?"
325,2,"What do high school students think Computer Science is?"
326,6,"What are the most effective ways to teach data structures?"
327,3,"Do tools like Alice help students understand object-oriented programming concepts in CS2?"
328,1,"Can some teaching practices make a difference to students' ability to write programs, or is learning to program primarily a matter of practice?"
329,9,"To what degree are students able to attain higher levels of understanding (as per Bloom's Taxonomy) in computing programs?"
331,6,"What teaching methods best help students remember the syntax of programming languages?"
336,7,"Is programming ability an intrinsic attribute, or can anyone become proficient at programming?"
338,3,"What are the best tools to use when teaching people how to program on smart phones?"
339,11,"How can we recruit more external (industry) partners to collaborate on classroom programming projects?"
340,11,"How can teachers stay up to date with changes to technology and programming practices?"
341,9,"What topics in computing are most difficult for high school students to grasp?"
342,8,"Is it more beneficial for new graduates of computing programs to have strong individual skills or strong team skills?"
349,6,"When and how is it best to present advanced computing techniques to students who are new to programming?"
351,6,"How and when is it best to give students feedback on their code to improve learning?"
352,8,"To what extent do people continue to program after moving into management positions?"
354,9,"Which student misconceptions about computing are most difficult to correct?"
355,6,"What are best practices for using computers in computing classes?"
356,8,"What topics or skills can be taught to primary/secondary students to best prepare them to learn or appreciate computing at college or university?"
357,1,"What are the relative merits of project-based learning, lecturing, and active learning for students learning computing?"
358,6,"What are the relative benefits of live coding vs presentations or guided exercises?"
359,4,"What are the most effective ways to keep diverse groups of students engaged when teaching computing?"
360,9,"What misconceptions do students have about operating systems?"
364,5,"What is the best balance between theory and hands-on practice in a computing program?"
365,2,"Do students have an accurate understanding of the time and effort required to learn programming?"
370,5,"What is the most effective way to teach digital technologies in high schools without diluting content?"
371,7,"Do female students learn computing more effectively in all-female classes?"
372,6,"What is the most effective way to teach control structures such as loops to students who are not computing majors?"
374,3,"What are the relative benefits of provisioning a computing environment for students vs requiring them to manage installation issues themselves?"
377,11,"What technical difficulties do teachers trying to use new tools or applications encounter?"
378,6,"Can student learning be enhanced by explicit lessons on how to use Stack Overflow and similar online forums?"
379,9,"At what developmental stage can people first effectively use 'variable' as an abstraction?"
380,6,"What are the characteristics of good homework assignments in computing classes?"
381,5,"What are the most effective ways for teachers to keep course materials up to date?"
382,4,"To what extent are 'free riders' actually a problem in group computing projects?"
383,8,"To what degree do different fields of graduate student require or rely on computing skills?"
384,6,"Does explicit reference to a programming language the student already knows help or hinder learning a second language?"
385,5,"What is the best way to integrate data management practices into a computing curriculum?"
386,8,"What can be done in high schools to close the gap between the supply of programmers and the demand for them?"
387,3,"If students have multiple courses using the same language, do they benefit more from using the same tools or from using a variety of tools?"
390,3,"What are the relative benefits of giving students standard hardware vs having them bring their own devices?"
391,10,"To what extent (if any) does the choice of first programming language affect students' interest in pursuing more programming courses?"
392,8,"How do the long-term career prospects for participants in coding bootcamps compare to those of students taking part in traditional classroom computing programs?"
394,4,"What can be done in class to motivate students to use good software engineering practices on larger projects?"
396,9,"Is 'expression' a threshold concept?"
397,9,"What affects students' ability to generalize from simple programming examples?"
398,7,"To what extent (if any) does the impact of using block-based programming in introductory courses vary according to student demographics (age, gender, orientation, etc.)?"
399,6,"How do learning outcomes differ when students use their own code and/or data in programming classes vs using code and/or data provided by the instructor?"
400,2,"What can teachers do to ensure adequate funding for computing classes?"
