ID,ParticipantID,QuestionID,Category (BB),Category (MC),Category (GW),Category (PD),Categories,UnifiedQuestion,RawQuestion,Why,What,
181,53,2,Languages and Tools,Curriculum,Languages and Tools,Languages and Tools,Languages and Tools,What impact does learning blocks-based tools like Scratch have on subsequently learning text-based tools like Python?,"Is it better to teach Scratch first before Python, or not at all?",Students don't seem to make a connection between drag and drop and text-based programming.,"Possibly just teach Python, but make it more fun, like the Scratch GUI",
182,3,5,Pipeline,Predictors,Pipeline,Predictors,Predictors,What effect does teaching students computing and computational thinking in primary school have on their performance in high school?,Does teaching students at primary school level computational thinking make a difference when they get to senior school?,To see the effect of change if teh basics of computational thinking are taught at a young age and the difference if makes when students get older?,Has an effect on how I teach my programme of teaching and learning at the senior school.,
183,29,1,Languages and Tools,Languages and Tools,Languages and Tools,Languages and Tools,Languages and Tools,What impact does choice of teaching language have on how much students learn about fundamental computing concepts?,How much of impact is choice of language to the learner?,Challenge my core belief that computing should be taught independent of language.,Either serves to reinforce my methods or perhaps be more devoted to a particular language.  ,
184,45,1,Broader Social Context,Broader Social Context,Broader Social Context,Curriculum,Broader Impact,Is it important for students to learn programming and digital technologies?,Why do you think that computing/digital technologies is important?,"In such a fast changing world, students should somehow know the overarching ""why?"" before they get down to the nuts and bolts of the ""how""",Get a better understanding of the mindset of the students that I teach.,
185,10,4,Languages and Tools,Languages and Tools,Languages and Tools,Languages and Tools,Languages and Tools,What is the best language to use when teaching introductory programming courses?,what is the most appropriate programming language to teach CS1,"There is such a variety, we are using Python, but what literature is there to say that this is the most appropriate, in fact the literature can change time dependent.","Select an appropriate language for CS1, which may help with Q3",
186,74,3,Pipeline,Pipeline,Pedagogy,Predictors,Student Behavior,How does a sense of self-efficacy influence students’ success outside of their courses?,How does self-efficacy improve the chances of success in the CS workforce (including academia and industry)?,Help students build confidence in their ability to pursue a career in the tech industry.,"Improve the classroom environment in my courses that will promote self-efficacy. This can be done through assignments, interactive lectures, and team work.",
187,44,2,Curriculum,Curriculum,Curriculum,Curriculum,Student Understanding,What impact does teaching introductory courses using only data analysis/machine learning examples have on student understanding?,Does teaching intro courses by solely aiming at ML/AI/Data Science examples and applications lead to different/new novice misunderstandings?,"There's a fair number of courses popping online, but also in person, even at very young ages. It's clear why: it's not clear to me whether the change of viewpoint of the material leads to a change in misconception(s).","If there are no major new misconceptions introduced by these approaches then some courses I teach would need modifying to focus more on this viewpoint, as there's a lot of student interest right now (some straight curiosity, some employability-driven).",
188,91,1,Pipeline,Awareness,Pipeline,Pipeline,Awareness,What programming experiences do people most often have before attending their first programming workshop?,What programming experience do participants have before attending a peogramming workshop?,To adapt to the target audience,Put more enfasis on the background they need before teaching something new,
189,79,1,Pedagogy,Pedagogy,Pedagogy,Pedagogy,Pedagogy,How can active learning be used most effectively in college-level computing courses?,How can active learning approaches be effectively used in university level computer science courses?,Active learning is a popular teaching strategy but seems to be under utilized in computer science.,Possibly change how I go about implementing active learning in my class room.,
190,6,1,Pipeline,Pipeline,Pipeline,Predictors,Pipeline,What impact (if any) does the language learned in high school have on students’ conceptual understanding of computing at college?,Does the programming language students learn at high school have any impact on the depth on which they understand programming concepts when going to university?,To understand which languages best teach programming knowledge and skills.,Potentially modify teaching program to include languages which create best understanding.,
191,38,2,Pedagogy,Curriculum,Pedagogy,Curriculum,Curriculum,What are the relative merits of teaching children logic vs teaching them programming?,Should children learn logic - not programming?,I think it is more significant initially to learn logic and not logic and programming simultaneously.,I will apply in practice,
192,3,1,Engagement,Engagement,Inclusivity,Awareness,Student Behavior,Why do students take computer science classes at university?,What draws students to taking computer science at University? ,"Ws there something that happened at secondary school that got students interested, or was it a first year paper at university that drew students to taking computer science?",To see the impact of computer science courses in secondary schools.,
193,100,4,Mental Models,Curriculum,Mental Models,Mental Models,Student Understanding,What fundamental programming concepts are the most challenging for students?,Which concepts are the hardest for university students to grasp? How can we prepare them?,"Athough highschool CS courses are not ""required"" I would like to know what concepts we should focus more on in high school courses to help undergraduate students.",It will be helpful to have a guide of what areas we should spend more time on.,
194,7,2,Curriculum,Pipeline,Languages and Tools,Languages and Tools,Languages and Tools,At what age is it appropriate to introduce text-based programming tools?,At what age is it appropriate to introduce text based programming,"Primary students know ""Scratch"" and not much more",Closer ties with primary and improve students computational thinking skills,
195,105,2,Pipeline,Pipeline,Pipeline,Pipeline,Pipeline,How many students are retained in each level of a typical college computing program?,How many students take each level of a college computing curriculum. ,It would be interesting to know the barrier for students advancing to upper level courses.,Evaluate the course where most students leave the track and make changes for student retention. ,
196,11,5,Engagement,Engagement,Student Behavior,Predictors,Engagement,"What features of classes, students, or pedagogy most affect attendance, engagement, and performance?",What features of classes / students / pedagogy / instruction moderate the relationship between attendence / reading / activity-engagement and course performance?,To understand how to teach better,Hopefully teach better.,
197,8,1,Inclusivity,Inclusivity,Inclusivity,Inclusivity,Inclusivity,What influences girls’ decisions to take K-12 computing classes?,How can we attract girls into computing?,Our school struggles to attract girls into digital computing and especially computer science,see if will work at our school,
198,102,1,Pedagogy,Curriculum,Pedagogy,Curriculum,Curriculum,"What is the best order in which to introduce control flow (e.g., loops) and functions?",Is there an optimal order for teaching students to write and use loops and teaching students to write and call functions?,"Teaching functions sooner might help students begin to think of problem decomposition and abstraction sooner (without using that term in class), but they may need more concrete tools with which to write meaningful functions.",Choose an ordering for my CS 1 course.,
199,62,3,Pedagogy,Pedagogy,Pedagogy,Curriculum,Pedagogy,What are the benefits of using large projects in class when teaching computing?,Should we be teaching coding through big projects so they learn organically or should there be more of a structure.,Is there certain skills that are crucial  that students know well before diving into project based learning. ,change the order of how to deliver the curriculum.,
200,105,3,Curriculum,Curriculum,Curriculum,Pipeline,Curriculum,What are the most important things that students finishing college-level computing programs still don’t understand?,What is the most important thing that students finishing a four-year degree still don't understand about computing?,I want to know what skills are necessary in the workplace but are not taught in 4 year degree programs. ,Add courses on these real life problems or incorporate the problems as labs in existing courses. ,
201,98,2,Broader Social Context,Broader Social Context,Broader Social Context,Broader Social Context,Pipeline,What topics in computing are going to be more important for students to learn in the near future?,What computing trends are growing?,I want to be able to offer material relevant to the modern market.,Perhaps offer a new course.,
202,61,1,Pedagogy,Pedagogy,Curriculum,Pedagogy,Curriculum,What is the best balance between theory and hands-on practice in teaching students programming?,"How should teachers balance foundational concepts with building tangible outcomes (products), if the latter comes at the expense of the former?",Students who won't go on to have computing be a primary focus in their careers likely have different needs from those who will go on to use computational tools more regularly. How to teach to the former group without depriving them of key concepts that they might be expected to know later?,Adjust the content of my courses,
203,30,5,Poor Question,Poor Question,Poor Question,Languages and Tools,DISCARD,DISCARD,"If we find answers to above (1-3), what would be the best interface to do what we now call programming.","I like programming. But not typing (or not seeing the result of my actions). I am physical, and would like to interact with the computer in a physical way.","I would like to see someone implement a better interface. My days are numbered, otherwise i would do it.",
204,80,1,Curriculum,Curriculum,Curriculum,Curriculum,Curriculum,What is the best order in which to teach basic computing concepts and skills?,In what order should topic X and Y be taught?," I cannot teach everything at once, although everything is related to everything else.",Change the order I teach things.,
205,17,3,Predictors,Predictors,Predictors,Predictors,Student Understanding,Does teaching students computer science theory help them program (either while students or afterward)?,Does studying algorithms and discrete mathematics help students be better computer scientists?,"We spend a lot of time with algorithms and discrete math, like a lot of universities. It's not obvious to me how much of these requirements are historical (because CS depts grew from maths depts) vs essential. That is, how much of it _is_ computer science vs doing math with computer science concepts. To that end, I wonder: what if we set up an experiment where two cohorts went through the same curriculum, except one took these courses and the other didn't. In five years after graduating, could we see a difference in their ability to choose algorithms and data structures? What if it was just one course? etc.",Revise and refine curricula.,
206,60,2,Mental Models,Mental Models,Mental Models,Mental Models,Student Understanding,What incorrect mental models do students bring to their first computing courses?,What are the incorrect mental models that students bring to CS1?,Improve CS1,Same,
207,83,2,Pedagogy,Inclusivity,Pedagogy,Assessment,Pedagogy,Does growth mindset instruction alter outcomes in computing courses?,Does infusing Growth Mindset instruction into a Computer Science class improve student outcomes?,Growth Mindset has been a hot topic in my district and I wonder how much influence it has.,If it has a big influence that I will add Growth Mindset lessons in my computer science class.,
208,92,1,Languages and Tools,Languages and Tools,Languages and Tools,Languages and Tools,Languages and Tools,What impact does learning blocks-based tools like Scratch have on subsequently learning text-based tools like Python?,"How can Scratch help learners with programming concepts such as loops, conditionals etc? Will this help them when learning python for example?",I teach coding to Junior Cycle students. I believe there is so much scope for learning programming concepts through Scratch.,Use it in my teaching. Would like to be able to link Scratch and Python - for when I go to teach Python.,
209,50,3,Professional Development,Professional Development,Professional Development,Professional Development,Teacher Development,(How) can teachers avoid burnout in the face of rising enrolments without compromising quality of instruction?,"Many teachers are seeing large classes, and burnout is a real possibility. How do we realistically set boundaries on the amount of time we spend, without compromising student learning?",The answer is implicit in the question.,"Use it in setting boundaries in my own life (I love my job, but I'm tired of spending evenings and weekends working), and pass it along to others.",
210,26,1,Mental Models,Inclusivity,Mental Models,Assessment,Student Understanding,Does learning programming involve mental barriers that do not exist in other subjects?,What are the mental blocks students have to learning programming that they don't have when learning other things?,"Anyone can learn programming but lots of people (especially ones who are underrepresented in tech) think of themselves as ""dumb"" or that they ""just don't get it""",I want to figure out a way to frame programming honestly as both complex and welcoming,
211,67,1,Curriculum,Curriculum,Curriculum,Languages and Tools,Curriculum,How do colleges justify their choice of their introductory programming language?,Why do Computer Science and Engineering schools teach C as a first programming language?,I presume that the reason is historical. I keep hearing that C is the best option in 2018,Try to change the syllabus,
212,1,1,Poor Question,Poor Question,Poor Question,Poor Question,DISCARD,DISCARD,Ignore - test from Paul,Ignore - test from Paul,Ignore - test from Paul,
213,27,1,Inclusivity,Inclusivity,Inclusivity,Inclusivity,Perception of Computing,Why do some teachers believe that some students “get it” and some don’t when it comes to programming?,Are there only certain types of people that can effectively learn programming? ,"Some students really seem to grasp the concepts and principles of programming, they can navigate the logic better than others. Some students never seem to grasp it. What makes someone better than others at learning programming and how can we identify who is in each category? ","If there are answers to this question, I would like to be able to evaluate students before they start learning and then know which students will have a better go at learning to program. It would help me segment my class and better know how to help those who struggle. ",
214,91,3,Inclusivity,Inclusivity,Inclusivity,Inclusivity,Inclusivity,What can teachers do to improve participation by underrepresented groups in computing?,"How to find women programmers, or better expressed with programming skills?",We need more women representation,Encourage a more diverse presence in computing,
215,72,3,Languages and Tools,Languages and Tools,Pedagogy,Assessment,Student Practices,Does planning a program using pseudocode or flowcharts before starting to code improve students’ outcomes?,Does the use of planning tools like flowchart help beginners learn to code?,"We have to teach planning as it is part of the assessment. However, most students, especially at lower levels, do not like writing down the steps of algorithm in their program. They write the code first then change it back to natural language for the sake of planning.","Thinking ahead is important but I want to find out what kind of planning will help learners develop their programs. I am only talking about small programs for beginners (snippets  of code), not real world program where planning is essential.",
216,116,1,Pedagogy,Pedagogy,Pedagogy,Pedagogy,Pedagogy,What teaching strategies are most effective when dealing with a wide range of prior experience in introductory programming classes?,"What strategies (potentially among current ""active learning"" techniques) are most effective in early programming classes where there is a wide disparity in (programming) experience among students?","There are currently two entry points into the Computer Science major at the university where I am currently teaching: CS1 and CS2 . Students with little or no programming experience enroll in the CS1 course, everyone else is routed to the CS2 course. While all the students in the CS2 have taken some intro programming course, their level of experience varies significantly. I'd like to know how to best serve the majority of students in the class, without alienating those at the tail ends of the distribution.",The answer to this question will inform how I teach my CS2 class,
217,60,1,Predictors,Predictors,Predictors,Predictors,Predictors,"What is the relationship between student demographics (age, gender, orientation, etc.) and prior experience and their success in introductory college-level computing classes?",How does each student's backgrounds/preparation effect their success in CS1?,Improve CS1,Same,
218,30,3,Poor Question,Poor Question,Mental Models,Poor Question,DISCARD,DISCARD,How should time be reflected in computing,Another thing i have not figured out myself. Functional programming with it's concept of immutability is a (tiny) step in this direction,"Build better systems, easier to understand/modify/teach.",
219,24,5,Pedagogy,Pedagogy,Curriculum,Curriculum,Predictors,What is the effect of teaching students with pseudocode before teaching them with a programming language?,What are the trade-offs to teaching students pseudo code before learning a real language?,I believe that understanding how and why a program works is more important than learning a language's syntax or semantics.,I will consider the use of pseudo code as a precursor to actual programming.,
220,104,1,Pedagogy,Languages and Tools,Pedagogy,Languages and Tools,Languages and Tools,(How) do online/automated grading systems for programming affect learning outcomes?,"What is the impact of using autograders in programming course (as opposed to instructor provided feedback) on the quality of student programs? In other words, does human feedback, especially on programming style (readability, straightforward design, etc) make a difference?","The rise of very large programming courses has led to a near total reliance on autograders instead of human feedback. In industry, code quality is important, so it would be useful to know if current educational practice supports development of good development practices.",I can decide whether to move to autograding or not.,
221,57,3,Languages and Tools,Languages and Tools,Languages and Tools,Languages and Tools,Languages and Tools,What is the best hardware (such as programmable boards and robots) to use for introductory computing classes?,What is the best hardware to purchase for computer science classes.,Not sure about Pi versus Microbit. Other alternatives?,Make wise purchases with our very limited budget,
222,46,2,Pipeline,Pipeline,Languages and Tools,Languages and Tools,Pipeline,What is the best age at which to start teaching children a text-based programming language?,What is the best age to start students with a text-based programming language,It scares me a bit when I have Year 9's coming in saying they have 'already done Python'. It makes me worried Primary and Intermediate schools are rushing students and using all the resources they can as soon as they can and not leaving anything for Secondary schools. I also find that the way they have been taught is not 'best practice' as far as the industry is concerned,Same as with Question One. ,
223,14,3,Pipeline,Pipeline,Pipeline,Pipeline,Pipeline,What should I tell students who have impostor syndrome or self-doubt after hearing companies say that they only want the best of the best?,"When I go to work place presentations, they only seem to want the best of the best. If I have an average student am I best to tell them to stop wasting their time and to find a different subject that may bring them more success?","Because it is in each students best interest to study courses that will bring them ""success"". ","Tell them the ""truth"" so they can decide earlier rather than later.",
224,31,2,Assessment,Languages and Tools,Assessment,Assessment,Assessment,Do exams taken on a computer measure learning more accurately than written exams?,Do exams for novice programming students taken on the computer (e.g. involving writing and testing programs) more accurately measure student learning?,Our introductory programming courses for novices are taken on the computer. It can be challenging to convince my colleagues that doing so is a good idea. There is also a cost associated with the model.,Use it to inform possible changes to our exam policies in introductory programming courses.,
225,80,4,Predictors,Predictors,Student Behavior,Predictors,Student Behavior,Do students’ attitudes toward making mistakes predict how much they will enjoy computing courses and/or how well they will do in them?,Does the way students view making mistakes predict how much they enjoy courses teaching programming.,To learn programming you end up making lots of mistakes and hopefully learning from them. Some students look back at all the mistakes they made, others at all the mistakes they corrected/overcame. Can we predict based on some general assessment of how they view mistakes?,Tell my students.
226,73,3,Mental Models,Mental Models,Mental Models,Curriculum,Student Understanding,Is there such a thing as “computational thinking”?,"What is the conceptual structure of computing? Put another way, what is an empirically defensible definition of ""computational thinking?""",We do not have a body of evidence to inform decisions about what languages to teach or to study transfer of knowledge between languages. We don't have our conceptual equivalent of Newton's three laws or Evolutionary theory,Reorganize course content and plan my own research studies.,
227,11,2,Student Behavior,Student Behavior,Student Behavior,Student Behavior,Student Behavior,How can we motivate students in computing classes to do assigned readings?,How do I get university computer science students to read assigned readings? ,Because computer science students don't read enough,Hopefully increase reading,
228,22,3,Predictors,Predictors,Pedagogy,Predictors,Predictors,To what extent is being technically proficient in using a computer helpful to learning computer science?,Is being really efficient with 'using technology' helpful in learning computer science?,is there a growing disconnect between users and makers of technology?,not sure - get more information out there??,
229,16,2,Inclusivity,Inclusivity,Inclusivity,Inclusivity,Inclusivity,How do students with hearing disabilities learn computing?,How deaf people learn computer science?,Our research group work with deaf people literacy. It seems interesting understanding if that people learn different from non-deaf.,Understand how deaf people learn computer science could guide approaches to teach it to them.,
230,70,1,Pedagogy,Inclusivity,Pedagogy,Pedagogy,Pedagogy,What methods for teaching problem solving skills are most effective for different age groups?,"What methods for teaching problem solving skills work well with different age ranges?  (perhaps this could be limited to KeyStage 2, 3, 4 and 5 rather than actual ages)",So I can ensure the techniques we use are appropriate for each age group.,Plan lessons to teach the most effective method of problem solving in each age rang.,
231,33,3,Inclusivity,Inclusivity,Predictors,Predictors,Inclusivity, Predictors,What factors in K-12 education best predict success for female students in college-level computing and beyond?,what factors in 5-12 education are linked to success for women in CS in college and beyond,"i teach at a girls school and I have students who are fired up about CS now, but there are other challenges ahead (societal, expectations) that I want them to be ready to tackle.","Depends on the answer! Could start extracurricular or add to curriculum, bring in role models, conversations about what it looks like to be a woman in engineering."
232,11,3,Student Behavior,Student Behavior,Student Behavior,Engagement,Student Behavior,How can we motivate students in large courses to participate in exercises?,How do I get univesity computer science students to take in class activities and lab assignments seriously?,Because they don't seem to engage with assigned tasks,Increase engagement,
