ID,ParticipantID,QuestionID,Category (BB),Category (MC),Category (GW),Category (PD),Categories,UnifiedQuestion,RawQuestion,Why,What,
280,115,2,Languages and Tools,Languages and Tools,Languages and Tools,Languages and Tools,Languages and Tools,Is it possible to design programming languages that are significantly easier to learn than the ones in use today?,"Can a programming language be designed first as a usable language, understood by a majority of people? https://medium.com/bits-and-behavior/designing-learnable-teachable-and-productive-programming-languages-dagstuhl-trip-report-81e41bde84bd",Wouldn't it be wonderful for anyone to have one?,Try it! Learn it! Use it!,
281,61,4,Languages and Tools,Languages and Tools,Languages and Tools,Languages and Tools,Languages and Tools,What are the relative merits of using drag-and-drop/blocks-based tools vs textual tools for introductory programming classes?,Does software environment matter for learning outcomes (GUI text editor vs IDE vs command line vs notebooks)?,"I try to balance exposure to important tools with the conveniences of GUIs that often obscure principles, but am not sure if I am getting the balance anywhere near correct.",Adjust which platform I use to introduce or build on particular concepts.=,
282,18,1,Pipeline,Pipeline,Pipeline,Pipeline,Pipeline,What do colleges look for in students applying to enter computing programs?,What are the Colleges and Universities looking for from grade 12s,better prepare the students,focus on the skills that are missed,
283,75,3,Pedagogy,Pedagogy,Pedagogy,Student Behavior,Pedagogy,To what extent does frequent help from instructors and Tas help students who are struggling to master material in computing courses?,Students often seek help in courses and some seek help repeatedly.  Does regular help from TAs/instructors help or hurt students who are struggling to master course material?,I'd like to know how much help is too much and adjust strategies for helping regular visitors to office hours.,"Adjust office hour policies, if necessary/possible.",
284,101,1,Pedagogy,Pedagogy,Curriculum,Languages and Tools,Pedagogy,What is the effect of learning a framework or library in a language before mastering the language itself?,Is there a negative effect on learning a framework or library of a language before learning more of the language itself,There is a lot of arguments online that learning something like react or angular before having a deeper understanding of Javascript itself is detrimental to the learner.   ,I would like to inform the decisions of the curriculum I help teach with how much of the language should we teach before jumping into tools to help students build stuff,
285,86,1,Pedagogy,Inclusivity,Pedagogy,Inclusivity,Pedagogy,What is the most effective way to teach programming to children?,"What is the most effective way to teach children to program? Is it by building games, coding robots to do cool stuff, or writing apps? Does the answer vary by age, gender or parental socioeconomic status?",I've got a daughter :) ,Teach my daughter to code as best as I can,
286,76,4,Curriculum,Curriculum,Curriculum,Languages and Tools,Curriculum,How important is it to teach compiled programming languages?,"Do we need to teach a ""compiled"" programming language? And if yes when? After teaching python?","Because students learn python or matlab and as soon as we switch (or mix) with C, C++ or Fortran, they are completely lost. In terms of syntax, it is not very different. ",Maybe I would start having workshop centered around data for a given discipline where we learn a compiled language. But which one?,
287,52,2,Pipeline,Pipeline,Pipeline,Curriculum,Student Understanding,Does teaching students computer science theory help them program (either while students or afterward)?,What balance of CS theory vs practical engineering skills is most useful to new engineers?,"This question has been tricky for us - we think we've got a ""good"" balance, but don't have enough scale to test empirically what results in success, either in the first 6 months or in the long term.",Adjust our ratio of theory to practice.,
288,78,5,Pipeline,,Pipeline,Curriculum,Pipeline,How can we best involve students in computing education research?,How to involve students in professional research in computing curricula?,I think student as a researcher is underused potential in computing education. Involved in research. Students would receive a holistic view of the profession and identities therein.,Understand how to increase students' conceptual/holistic interest in the field in place of mere occupational prospect.,
289,8,3,Pipeline,Curriculum,Pipeline,Pipeline,Pipeline,What knowledge and skills are new entrants into computing programs most often missing that they need?,Is there a hole in the students knowledge when they go to uni in NZ,its hard to know what is required outside of the NCEA bubble,cover that topic better,
290,113,4,Poor Question,Languages and Tools,Poor Question,Curriculum,DISCARD,DISCARD,How can we envisage a textbook of the future.,"We need ways to combine the deep teacher expertise of classic textbooks, with emerging technology methods such as AIED and ways to complement and adpat classic textbook material to match local needs and state-of-the-art ie recent tech.",I would like to work on this to provide better ways to teach my students and to collaborate with others who would like to share in doing that.,
291,13,4,Pedagogy,Languages and Tools,Pedagogy,Languages and Tools,Languages and Tools,What are the best ways to make documentation about libraries and APIs accessible to students?,What are the best ways to make API documentation more accessible to students?,"online API documentation is incredibly detailed and requires a very high level of literacy to understand.  Students just freeze when they see it.  Coders use API docs all the time.  Creating student API references seems fraught with the danger of over-simplifying, but could be incredibly useful to them.",Write student-friendly API documentation for the programming languages I teach,
292,96,3,Languages and Tools,Languages and Tools,Languages and Tools,Languages and Tools,Languages and Tools,What are the relative merits of using computational notebooks (like Jupyter) vs teaching the same languages and content using traditional text formats?,Do notebooks (like Jupyter) enhance learning?  (Over learning the same language without a notebook),"There's been a lot of twitter debate lately about whether Jupyter is useful, but I don't think I've seen any evidence",potentially change curriculum,
293,102,3,Languages and Tools,Languages and Tools,Languages and Tools,Curriculum,Languages and Tools,What are the relative merits of using a typed vs untyped language in an introductory programming class?,What are the benefits and drawbacks of manifest types for novice programmers?,"Types that are manifest in the code offer students support, but they also require deeper consideration of a new concept earlier and make it harder for novices to get their programs to run.",Take it into account when selecting languages for CS 1 and future courses.,
294,39,1,Languages and Tools,Languages and Tools,Languages and Tools,Languages and Tools,Student Understanding,What do we need to teach students so that they can transfer skills and understanding from one language to another?,"Once students learn to program for data science in one language (e.g., R) how much support do they need to transfer these skills to another language (e.g., Python)","At my institution we are trying to decide how to teach Data Science to undergraduates (e.g., create courses, minors, etc) and we wonder if we have a foundational course in one language, how will students do in a follow-on course in another language. This is important as different disciplines culturally use different languages (e.g., R in Biology and Python in Earth and Ocean sciences). So we cannot avoid later year courses being in different languages, but we might decide to have one foundational course.",Inform decisions about undergraduate curriculum design.,
295,4,1,Mental Models,Mental Models,Broader Social Context,Pipeline,Pipeline,How can we help students connect what they have learned in class with what they encounter in the workplace?,How can a student connect computational thinking/programming they learn in the classroom with what they encounter in their workplace?,"I want to understand how students make connections between their classroom and work experiences. The two worlds seem to be disconnected, and even though university classes should teach abstract and generalised knowledge, giving heuristics to connect this knowledge is also important. ",I would use it in my research on how people connect different fields (business and IT) and also use the heuristics to gauge my teaching methods.,
296,43,4,Inclusivity,Broader Social Context,Inclusivity,Broader Social Context,Broader Impact,Are different regions taking different approaches to computing education?,"Are there national zones for different computer science educational trends? Do certain regions teach more object oriented languages, block languages, static or dynamic programming, web development? ",I believe having a large scale survey of who teaches what is both attainable and educationally valuable. Teachers will often argue about the merits of different programming languages like python or java. Others with discuss the benefits of block languages as an introduction to programming. Before any of those answers can be obtained I believe that what is currently taught where needs to be documented. Maybe a tend will present itself within the data showing achievement zones that demonstrate one philosophy of education in CS to be more effective? I am unaware of any large scale database that contains this knowledge and many states have information available that is simply waiting to be compiled into a single location. ,Reinforce or adjust my practices to align with what is most valuable for my students. ,
297,34,3,Awareness,Inclusivity,Awareness,Awareness,Awareness,What factors have led to the increase in the number of students taking computing courses in the past few years?,What has caused the noticeable increase in the number of students taking CS and CE courses in the last few years?,"To maintain this trend, especially for female students",Do what I can to support growth.,
298,57,2,Curriculum,Curriculum,Curriculum,Languages and Tools,Curriculum,How should programming be balanced with other activities in computing classes?,Should coding be balanced with other computer applications in courseware?,Not sure if coding is suited to all students,Use it in designing our JC curriculum.,
299,9,5,Professional Development,Professional Development,Professional Development,Professional Development,Teacher Development,How can we better connect subject matter experts who lack teaching expertise with experts in teaching who lack in-depth computing knowledge?,"Most academics are subject matter experts with little to no educational experience.  The staff in the universities ""educational"" section who have to help academics develop their courses have little to know subject knowledge.  This creates a disconnect in teaching and learning, how can this be addressed to improve teaching programming modules?","Many academics, especially in the ODeL environment don't have educational experience and find it difficult to transfer knowledge to their students.  The educational specialists have a lot of educational theories they want academics to apply, but are unable to communicate HOW the academics should do this.  It leads to materials being provided to students that are possibly subject specific ""strong"", but educationally ""poor"".",Improve teaching and learning. Publish findings.,
300,74,1,Pedagogy,Pedagogy,Pedagogy,Pedagogy,Pedagogy,What are the most effective ways to scale computing education to reach the general student population?,What are the most effective ways to scale CS education to reach the general student population?,CS enrollment is at a all-time high and CS proficiency for the general college student population is important for the current job market. How can we open the doors to service many students without sacrificing educational quality?,Implement best practices within our own department to serve the general campus population.,
301,86,3,Pedagogy,Pedagogy,Pedagogy,Curriculum,Pedagogy,What is the most effective way to teach algorithms in computing courses?,"What is the best way to learn about algorithms in a compsci course? Coding from scratch? Pseudocode? Should we cover more algorithms less deeply, or code 2-3 from scratch?",Teaching code,Use the results to develop courses to teach coding better,
302,47,4,Pedagogy,Pipeline,Predictors,Predictors,Predictors,What are the benefits (if any) of having a mathematics prerequisite to an introductory computing course?,What is the longitudinal benefits of a mathematics prerequisite to an introductory course?,"I've had peers argue that we should gate the intro sequence via a math requirement. However, some of our best majors started out in our non-major sequence.",Use this to inform decisions regarding requirements for the introductory sequence.,
303,90,1,Pedagogy,Pedagogy,Pedagogy,Pedagogy,Pedagogy,What are the best ways to teach programming to people with no previous programming experience?,What is the best way to teach programming to first time programmers with no previous experience,So I can structure my teaching and course to best meet the needs of my new programmers,"create a viable progression from basics through to advanced, starting then off in the best way to ensure success from the start",
304,39,2,Curriculum,Curriculum,Curriculum,Curriculum,Curriculum,"When should students learn how to install software, manage paths and environments, etc.?","When should students learn about the nitty gritty of installation, path and environment management?","For our Master's of Data Science program we think it is important that students learn to install the programs they need, and manage their Path and environment. But this isn't very exciting stuff, nor is it easy/trivial. So when is the right time to teach it? Right away so they can get up and running on their own machines? Or introduce them to Data Science in the cloud first and then teach them to set things up on their own machines (or the cloud) later?",Potentially change when we teach these topics in our program.,
305,96,2,Languages and Tools,Languages and Tools,Languages and Tools,Languages and Tools,Languages and Tools,What is the best language to use when teaching introductory programming courses?,"Is there a 'best' starter language(s)? A language or languages that make it much easier to learn a second one? Conversely, are there 'bad' starter languages? Ones that give little or no advantage? ","Obviously, if we want to teach programming before people know what problem they're going to solve with it, we want to teach them a language that makes future languages easier.",potentially rearrange curriculum ,
306,113,3,Pedagogy,Pedagogy,Pedagogy,Curriculum,Pedagogy,What is the most effective way to teach students how to test software?,How to help students learn to design rigorous testing for IT.,"I see this as a mindset issue and linked to taking personal responsibility for quality - and I see it as broad, including testing interfaces for usability, usefulness and user satisfaction, as well as the other end of the spectrum, from engineering tests....",Evidence about how to do this could inform curriculum design as well as providing off-the-shelf teaching methods.,
307,60,3,Curriculum,Pedagogy,Curriculum,Curriculum,Curriculum,"How do teaching approaches differ between Computer Science, Information Technology, and related disciplines?",What is the difference between CS/IT/CSE educational styles?,Reliance upon math in CS departments can turn off students,Unknown,
308,54,2,Pipeline,Pedagogy,Predictors,Engagement,Engagement,(How) can we leverage students’ prior experiences to create more engaging curricula?,"What are the aspects of students' background experiences which we can leverage to create more engaging, relevant, and learnable curricula?","The area of curriculum design and ""how to best teach CS"" is still quite nascent, unlike mathematics or the other sciences which have had considerable years of research to fall back upon. It's a lot less clear what works well in CS, and it's likely to differ by population.","Motivate pedagogical practices, curriculum design, and interventions for students. Design new learning environments that optimize for best practices.",
309,106,1,Pipeline,Curriculum,Pipeline,Pedagogy,Curriculum,What is the best order in which to teach basic computing concepts and skills?,"How do students best learn programming concepts over time? How is this sequence affected by student background, pedagogy, didactic approach, etc?","Understanding how students learn, what they find difficult, and how the order in which they grasp concepts helps or hinders their learning is fundamental to building a theory of learning in computing and to improving how we teach.","If we understand the order in which students best learn programming concepts and the alternative pathways they may take, we can use this to inform curriculum design, pedagogy, and didactic approaches.",
310,55,4,Languages and Tools,Languages and Tools,Languages and Tools,Languages and Tools,Languages and Tools,What is the best balance between using modern software development tools and overloading students?,What's the balance between using modern tools and tool overload?,trying to think about what tools to incorporate in my teaching 'cause I tend to go overboard and try to include all the librariers/tools/etc,recalibrate my lessons,
311,64,2,Predictors,Predictors,Predictors,Predictors,Predictors,What factors in K-12 education best predict success for students in college-level computing and beyond?,Are there any subjects from high school that are associated with good performance in tertiary Computer Science?,To ensure that my department's entrance requirements are adequate.,Address my department's entrance requirements,
312,72,2,Languages and Tools,Languages and Tools,Curriculum,Languages and Tools,Languages and Tools,How effective are game development tools like Unity for teaching computing vs conventional languages like Python?,"Some schools teach programming in the context of game development, eg Unity. Is it more effective than using Python?","Majority of my students are boys who would be interested in game development. But I feel it would push girls out of the class, and there is a lot more in programming than gaming.",Adapt my teaching programme to meet the needs of students.,
313,43,1,Professional Development,Professional Development,Predictors,Professional Development,Teacher Development,"What factors inspire high school computer science teachers, increase their confidence, and lower attrition rates?","Identify the common traits that inspire new secondary computer science teachers to have high confidence, low attrition, and best prepare them for teaching in secondary education environments?  ","Teacher training in the field of computer science is a huge problem that needs to be solved. Once a teacher enters the field, teacher support and retention are of paramount importance. ",Use the information to inform teacher preparatory programs and districts how to best assist new CS educators. ,
314,95,3,Curriculum,Curriculum,Pipeline,Curriculum,Curriculum,What concepts are taught in college-level computing programs?,What concepts are taught at the university level?,To help prepare my students for entry into university.,Add any missing components to my teaching.,
315,25,3,Poor Question,Poor Question,Languages and Tools,Languages and Tools,DISCARD,DISCARD,"What are the best ways to progam server based, mobile programs and how can I teach this (specific coding examples)?",I would like to teach a unit on setting up a game server.,Set up a unit on setting up a game server and perhaps another business type program. ,
316,68,4,Inclusivity,Inclusivity,Inclusivity,Inclusivity,Inclusivity,How has the uptake of for-profit STEM-oriented daycare and camps by middle-class and affluent families affected the degree to which computing programs are accessible to students from less affluent backgrounds?,"Camps and daycare for kids used to be fairly generic and play-based.  Now there are more 'boutique' options for kids driven by the STEM push such as code camps, science camps, etc.  These are often delivered by for-profit companies, and can be quite costly.  Has this led to a socioeconomic gap in the students who choose to pursue the discipline (which we may not see until another 5-10 years from now)?","If I was to implement my own version of a Code Camp, what would I need to be aware of in order to not contribute to equity concerns.",,
317,50,1,Pedagogy,Pedagogy,Pedagogy,Pedagogy,Pedagogy,What is the single most effective change Computer Science departments could make to their teaching practices?,"If our whole department were to commit to one change in how we teach, in order to facilitate better student learning, what should that change be and why?","We want our students to learn better, but we are being bombarded with myriad suggestions. What works, what works best, and what is something that we as an entire department can focus on?",Promote it to other faculty and to the department as a whole. Use it as a focus for departmental teaching improvement.,
318,80,2,Pedagogy,Pedagogy,Pedagogy,Assessment,Pedagogy,Do data diagrams help students understand language features and code execution?,Do data diagrams help students understand language features and code simulation (when system provided or students taught to draw themselves),I spend a good amount of time teaching students to draw these and use them in hand simulation.,Determine whether to keep sinking time in this activity.,
319,20,1,Mental Models,Mental Models,Mental Models,Student Behavior,Student Understanding,How often do students have “ah ha” moment in computing courses in which things suddenly start to make sense?,"Do students, who are new to programming, have an ""Ah Ha"" moment, where everything makes sense?","Because i had such a moment when i was in first computer science and everything after that moment was easy but up until that moment, i didnt really understand what i was doing, i was just following along blindly. I wondered if others have such a moment.",Change the way i teach first year,
320,95,1,Broader Social Context,Broader Social Context,Poor Question,Broader Social Context,DISCARD,DISCARD,What will programming look like in 10 years?,The answer to this question will shape the skills we need to give computer science today.,I suspect it could shape how I teach computer science today. I am thinking I would like to provide input to the Ministry of Education about the future of the Computer Science curriculum as well.,
321,54,3,Pedagogy,Pedagogy,Student Behavior,Pedagogy,Pedagogy,How can we help students become comfortable with failure in computing courses?,How can we help students grow accustomed to failure in CS courses?,One area that is very different about CS as compared to the mathematics or other hard sciences like physics is how students constantly face failure when debugging programs and throughout the process of learning this discipline which requires discarding a lot of past experiences and instead thinking of computers as formal systems.,"Motivate pedagogical practices, curriculum design, and interventions for students. Design new learning environments that optimize for best practices.",
322,43,3,Broader Social Context,Broader Social Context,Predictors,Inclusivity,Broader Impact,What factors have led to differences in the implementation of computing in secondary education in different regions?,"Are there any observable factors(social, cultural, socioeconomic, etc) that have lead some states to be slow adopters of Computer Science as a field of study in secondary education? What common threads can be found in communities that have prioritized CS education?  ",I live in a state that does not require computer science at primary or secondary schools. My state's university system does not accept CS as a math or science credit for entry. 10% of schools in my state offer a single CS course at all. I want to know why my community is so slow to adopt this global trend in education. ,I would use a study like this to advocate change in my state's legislature. I want this kind of study to occur so that it can continue to drive CS education in unincorporated regions. ,
323,56,1,Poor Question,Poor Question,Professional Development,Curriculum,DISCARD,DISCARD,What is everyone else doing?,Am I up to scratch,Either relax or upskill,
324,117,4,Pedagogy,Pedagogy,Pedagogy,Curriculum,Pedagogy,What is the best way to use extended programming tasks in large computing courses?, How can extended programming tasks be used in a large course? ," Assessment using an extended programming task or project is appealing in that it provides an ""authentic"" test of ability, and students find it enjoyable. However, it brings a high staff marking workload, and it is particularly hard to ensure fair and consistent marking: if students all have different projects then their work is hard to compare (and even more effort is needed to set the tasks) but if many students are carrying out the same task then it is hard to know how much of the work is the student's own. Currently we use ""mini-projects"" only in fairly small courses. ", Consider using more authentic extended tasks in assessment of our larger computing courses. ,
